{
  "version": "1.0",
  "date": "2026-03-26",
  "generated_at": "2026-03-26T01:54:12.156Z",
  "constraints": {
    "category_targets": {
      "technology": 5,
      "finance": 5,
      "world": 5,
      "ai": 5,
      "society": 5
    },
    "paper_target_min": 3,
    "paper_target_max": 5
  },
  "categories": [
    {
      "id": "technology",
      "label": "科技",
      "target": 5,
      "available": 5
    },
    {
      "id": "finance",
      "label": "财经",
      "target": 5,
      "available": 5
    },
    {
      "id": "world",
      "label": "国际",
      "target": 5,
      "available": 5
    },
    {
      "id": "ai",
      "label": "AI",
      "target": 5,
      "available": 5
    },
    {
      "id": "society",
      "label": "社会热点",
      "target": 5,
      "available": 5
    }
  ],
  "news": {
    "technology": [
      {
        "id": "news-8ddc47ea181d",
        "type": "news",
        "category": "technology",
        "title_en": "Apple overhauls its app developer platform with 100 new metrics, more tools",
        "title_zh": "今日快讯：Apple overhauls its app developer platform with 100 new metrics, more tools",
        "summary_zh": "Apple is adding 100+ new App Store Connect metrics, giving developers deeper, first-party insights into monetization, subscriptions, and user behavior as it doubles down on its app ecosystem in the 人工智能 era.",
        "highlights_zh": [
          "核心主题：今日快讯：Apple overhauls its app developer platform with 100 new metrics, more tools",
          "信息来源：TechCrunch（2026/3/25）",
          "可能影响技术产品路线与开发者生态。"
        ],
        "source_name": "TechCrunch",
        "source_url": "https://techcrunch.com/2026/03/25/apple-overhauls-its-app-developer-platform-with-100-new-metrics-more-tools/",
        "published_at": "2026-03-25T17:26:46.000Z",
        "score": 90.03,
        "tags": [
          "Apps",
          "Apple",
          "developers",
          "app store",
          "app store connect"
        ]
      },
      {
        "id": "news-e9118c38d3e1",
        "type": "news",
        "category": "technology",
        "title_en": "Mercor competitor Deccan AI raises $25M, sources experts from India",
        "title_zh": "Mercor competitor Deccan 人工智能 raises $25M, sources experts from India",
        "summary_zh": "Deccan 人工智能 concentrates its workforce in India to manage quality in a fast-growing but fragmented 人工智能 training 市场.",
        "highlights_zh": [
          "核心主题：Mercor competitor Deccan 人工智能 raises $25M, sources experts from India",
          "信息来源：TechCrunch（2026/3/26）",
          "可能影响技术产品路线与开发者生态。"
        ],
        "source_name": "TechCrunch",
        "source_url": "https://techcrunch.com/2026/03/25/deccan-ai-raises-25m-as-ai-training-push-relies-on-india-based-workforce/",
        "published_at": "2026-03-26T00:30:00.000Z",
        "score": 86.85,
        "tags": [
          "Startups",
          "AI",
          "Susquehanna International Group",
          "A91 Partners",
          "Prosus Ventures",
          "Deccan AI"
        ]
      },
      {
        "id": "news-53d2ff633e18",
        "type": "news",
        "category": "technology",
        "title_en": "Delve did the security compliance on LiteLLM, an AI project hit by malware",
        "title_zh": "Delve did the 安全 compliance on LiteLLM, an 人工智能 project hit by malware",
        "summary_zh": "LiteLLM offers an 人工智能 开源 project used by millions that was infected by credential harvesting malware.",
        "highlights_zh": [
          "核心主题：Delve did the 安全 compliance on LiteLLM, an 人工智能 project hit by malware",
          "信息来源：TechCrunch（2026/3/26）",
          "可能影响技术产品路线与开发者生态。"
        ],
        "source_name": "TechCrunch",
        "source_url": "https://techcrunch.com/2026/03/25/delve-did-the-security-compliance-on-litellm-an-ai-project-hit-by-malware/",
        "published_at": "2026-03-26T00:03:52.000Z",
        "score": 86.3,
        "tags": [
          "Security",
          "Startups",
          "TC",
          "Delve",
          "malware",
          "security compliance"
        ]
      },
      {
        "id": "news-34b9eae2aa6a",
        "type": "news",
        "category": "technology",
        "title_en": "Razer’s new Blade 16 gaming laptop has an Intel Panther Lake chip and very fast RAM",
        "title_zh": "Razer’s new Blade 16 gaming laptop has an Intel Panther Lake 芯片 and very fast RAM",
        "summary_zh": "Razer is giving its Blade 16 gaming laptop a speed and battery boost for 2026. The high-end gaming laptop keeps the same thin chassis and RTX 50-series GPU options as last year's 模型, but it's now making the switch from A",
        "highlights_zh": [
          "核心主题：Razer’s new Blade 16 gaming laptop has an Intel Panther Lake 芯片 and very fast RA",
          "信息来源：The Verge（2026/3/25）",
          "可能影响技术产品路线与开发者生态。"
        ],
        "source_name": "The Verge",
        "source_url": "https://www.theverge.com/gadgets/900518/razers-new-blade-16-gaming-laptop-has-an-intel-panther-lake-chip-and-very-fast-ram",
        "published_at": "2026-03-25T20:36:58.000Z",
        "score": 85.29,
        "tags": []
      },
      {
        "id": "news-b9bb4fc707cd",
        "type": "news",
        "category": "technology",
        "title_en": "Intel and LG Display may have beaten Apple and Qualcomm with the best laptop battery life ever",
        "title_zh": "今日快讯：Intel and LG Display may have beaten Apple and Qualcomm with the best laptop battery life ever",
        "summary_zh": "今日快讯：One of the coolest laptops we saw at CES in January was the new Dell XPS 16, with a unique 1-120Hz variable refresh rate display that can sip power when you don't need the screen to stay speedy. Just how little powe",
        "highlights_zh": [
          "核心主题：今日快讯：Intel and LG Display may have beaten Apple and Qualcomm with the best lapto",
          "信息来源：The Verge（2026/3/26）",
          "可能影响技术产品路线与开发者生态。"
        ],
        "source_name": "The Verge",
        "source_url": "https://www.theverge.com/tech/901155/dell-xps-16-best-battery-lg-display-1hz-panther-lake-intel",
        "published_at": "2026-03-26T00:33:07.000Z",
        "score": 84.21,
        "tags": []
      }
    ],
    "finance": [
      {
        "id": "news-49f5102d115b",
        "type": "news",
        "category": "finance",
        "title_en": "This ‘single greatest’ stock-market predictor has never been more bearish",
        "title_zh": "This ‘single greatest’ stock-市场 predictor has never been more bearish",
        "summary_zh": "Retail investors have loaded up on stocks, which is typical before a bull 市场 peaks.",
        "highlights_zh": [
          "核心主题：This ‘single greatest’ stock-市场 predictor has never been more bearish",
          "信息来源：MarketWatch（2026/3/26）",
          "可能影响资本市场预期与资产定价。"
        ],
        "source_name": "MarketWatch",
        "source_url": "https://www.marketwatch.com/story/this-single-greatest-stock-market-predictor-has-never-been-more-bearish-5d8c48d1",
        "published_at": "2026-03-26T00:02:00.000Z",
        "score": 94.66,
        "tags": []
      },
      {
        "id": "news-8dc507b4d58e",
        "type": "news",
        "category": "finance",
        "title_en": "Asia markets trade mixed as Iran rules out direct U.S. talks despite reviewing proposal",
        "title_zh": "今日快讯：Asia markets trade mixed as Iran rules out direct U.S. talks despite reviewing proposal",
        "summary_zh": "今日快讯：Asia-Pacific markets traded mixed after Iran signaled it had no intention of holding direct talks with the United States.",
        "highlights_zh": [
          "核心主题：今日快讯：Asia markets trade mixed as Iran rules out direct U.S. talks despite review",
          "信息来源：CNBC Top News（2026/3/26）",
          "可能影响资本市场预期与资产定价。"
        ],
        "source_name": "CNBC Top News",
        "source_url": "https://www.cnbc.com/2026/03/26/asia-pacific-markets-live-updates-nikkei-225-kospi-hang-seng-index.html",
        "published_at": "2026-03-26T00:10:27.000Z",
        "score": 91.54,
        "tags": []
      },
      {
        "id": "news-83aa0929ec18",
        "type": "news",
        "category": "finance",
        "title_en": "Jim Cramer says Wall Street is in denial about the market",
        "title_zh": "Jim Cramer says Wall Street is in denial about the 市场",
        "summary_zh": "Wall Street is in denial about the 市场's strength, Jim Cramer said, arguing that investors are dismissing falling oil prices and the \"presidential Put.\"",
        "highlights_zh": [
          "核心主题：Jim Cramer says Wall Street is in denial about the 市场",
          "信息来源：CNBC Top News（2026/3/25）",
          "可能影响资本市场预期与资产定价。"
        ],
        "source_name": "CNBC Top News",
        "source_url": "https://www.cnbc.com/2026/03/25/jim-cramer-wall-street-denial-market.html",
        "published_at": "2026-03-25T22:29:55.000Z",
        "score": 89.44,
        "tags": []
      },
      {
        "id": "news-e70312011a17",
        "type": "news",
        "category": "finance",
        "title_en": "Rep. Seth Moulton bans staff from using prediction markets like Kalshi, Polymarket",
        "title_zh": "今日快讯：Rep. Seth Moulton bans staff from using prediction markets like Kalshi, Polymarket",
        "summary_zh": "今日快讯：Congressional lawmakers are ramping up efforts to rein-in prediction markets.",
        "highlights_zh": [
          "核心主题：今日快讯：Rep. Seth Moulton bans staff from using prediction markets like Kalshi, Pol",
          "信息来源：CNBC Top News（2026/3/25）",
          "可能影响资本市场预期与资产定价。"
        ],
        "source_name": "CNBC Top News",
        "source_url": "https://www.cnbc.com/2026/03/25/seth-moulton-prediction-market-ban-kalshi-polymarket.html",
        "published_at": "2026-03-25T22:22:22.000Z",
        "score": 89.29,
        "tags": []
      },
      {
        "id": "news-9fce854e18e9",
        "type": "news",
        "category": "finance",